{"$schema":"https://json-schema.org/draft/2020-12/schema","$id":"https://thedailyline.bet/schemas/video/v1/creative-plan.schema.json","title":"CreativePlan","type":"object","additionalProperties":false,"required":["schema_version","video_story_id","creative_variant_id","template_ref","render_profile_ref","hook_variant_ref","brand_sting_mode","brand_sting_placement","caption_style_ref","voice_profile_ref","cta_profile_ref","scene_plan","asset_policy_ref","music_policy_ref","disclaimer_profile_ref","experiment_refs","creative_plan_digest"],"properties":{"schema_version":{"const":"creative-plan.v1"},"video_story_id":{"$ref":"common.schema.json#/$defs/Id"},"creative_variant_id":{"$ref":"common.schema.json#/$defs/Id"},"template_ref":{"$ref":"common.schema.json#/$defs/Ref"},"render_profile_ref":{"$ref":"common.schema.json#/$defs/Ref"},"hook_variant_ref":{"$ref":"common.schema.json#/$defs/Ref"},"brand_sting_mode":{"enum":["micro","opener","transition","outro","none"]},"brand_sting_placement":{"type":"string","minLength":1},"caption_style_ref":{"$ref":"common.schema.json#/$defs/Ref"},"voice_profile_ref":{"oneOf":[{"$ref":"common.schema.json#/$defs/Ref"},{"type":"null"}]},"cta_profile_ref":{"$ref":"common.schema.json#/$defs/Ref"},"scene_plan":{"type":"array","minItems":1,"items":{"$ref":"#/$defs/ScenePlanItem"}},"asset_policy_ref":{"$ref":"common.schema.json#/$defs/Ref"},"music_policy_ref":{"$ref":"common.schema.json#/$defs/Ref"},"disclaimer_profile_ref":{"$ref":"common.schema.json#/$defs/Ref"},"experiment_refs":{"$ref":"common.schema.json#/$defs/RefSet"},"creative_plan_digest":{"$ref":"common.schema.json#/$defs/Digest"}},"$defs":{"ScenePlanItem":{"type":"object","additionalProperties":false,"required":["scene_id","scene_type","position","claim_refs","fact_refs","explanation_refs","asset_slots","duration_policy","transition_in_ref","transition_out_ref","layout_variant"],"properties":{"scene_id":{"$ref":"common.schema.json#/$defs/Id"},"scene_type":{"enum":["hook","matchup","stat","comparison","line_movement","weather","model_probability","reason","pick_reveal","results","data_story","brand_transition","outro"]},"position":{"type":"integer","minimum":0},"claim_refs":{"$ref":"common.schema.json#/$defs/RefSet"},"fact_refs":{"$ref":"common.schema.json#/$defs/RefSet"},"explanation_refs":{"$ref":"common.schema.json#/$defs/RefSet"},"asset_slots":{"$ref":"common.schema.json#/$defs/RefSet"},"duration_policy":{"type":"object"},"transition_in_ref":{"type":["string","null"]},"transition_out_ref":{"type":["string","null"]},"layout_variant":{"type":"string","minLength":1}}}}}
