{"schema_version":"creative-plan.v1","video_story_id":"story.mlb.sf-lad.20260908.1","creative_variant_id":"creative.mlb.sf-lad.20260908.1a","template_ref":"single_pick_v1@1.0.0","render_profile_ref":"vertical_social_v1@1.0.0","hook_variant_ref":"curiosity.v1","brand_sting_mode":"micro","brand_sting_placement":"after_hook","caption_style_ref":"kinetic.v1","voice_profile_ref":null,"cta_profile_ref":"follow-daily-line.v1","scene_plan":[{"scene_id":"scene.hook","scene_type":"hook","position":0,"claim_refs":["claim.model-edge"],"fact_refs":["fact.model-prob"],"explanation_refs":[],"asset_slots":["asset.hero"],"duration_policy":{"target_ms":2500},"transition_in_ref":null,"transition_out_ref":"wipe.fast.v1","layout_variant":"hook.large"},{"scene_id":"scene.reason","scene_type":"reason","position":1,"claim_refs":["claim.model-edge"],"fact_refs":["fact.model-prob","fact.market-prob"],"explanation_refs":["explanation.model-vs-market"],"asset_slots":["asset.data-bg"],"duration_policy":{"target_ms":7000},"transition_in_ref":"wipe.fast.v1","transition_out_ref":"line.v1","layout_variant":"comparison.v1"},{"scene_id":"scene.pick","scene_type":"pick_reveal","position":2,"claim_refs":["claim.pick"],"fact_refs":["fact.pick"],"explanation_refs":[],"asset_slots":["asset.data-bg"],"duration_policy":{"target_ms":4500},"transition_in_ref":"line.v1","transition_out_ref":"brand.v1","layout_variant":"pick.v1"},{"scene_id":"scene.outro","scene_type":"outro","position":3,"claim_refs":[],"fact_refs":[],"explanation_refs":[],"asset_slots":["asset.data-bg"],"duration_policy":{"target_ms":2000},"transition_in_ref":"brand.v1","transition_out_ref":null,"layout_variant":"outro.v1"}],"asset_policy_ref":"dlve-assets-generic.v1","music_policy_ref":"dlve-music-lowbed.v1","disclaimer_profile_ref":"sports-betting-general.v1","experiment_refs":[],"creative_plan_digest":"sha256:dab30749a6b8bc348054f9a922660234cd9aecf326730c040efbcbdd4e22e45b"}
